old_file,abstract
1801_00571_DetectionAndEstimationOfPartiallyObservedDynamicalSystems.tex," In real environments, it is seldom that physical dynamical systems can be observed without detection failures and without disturbances from the background. Yet, a vast majority of the literature regarding Bayesian inference for such systems ignore these undesired effects and assume that pre-processing can be applied to remove them. To some extent, this goes against the Bayesian philosophy which promotes the integration of the different aspects of the problem into a joint formulation. However, such a formulation usually involves a precise modelling of these adverse effects as well as the setting of the corresponding parameters, which is not always feasible or realistic. In this article, we propose to use outer measures of a certain form to allow for additional flexibility in the modelling of these effects within the Bayesian paradigm. It is shown that detection and estimation of partially-observed dynamical systems can be performed with little to no knowledge about the background disturbances and with only an upper bound on the probability of detection failure. It is conformed in simulations that such an approach can compete with standard methods even when the latter are given the true parameter values. "
1801_04080_contracts.tex,"  In a continuous-time setting where a risk-averse agent controls the  drift of an output process driven by a Brownian motion, optimal  contracts are linear in the terminal output; this result is  well-known in a setting with moral hazard and -- under stronger  assumptions -- adverse selection.  We show that this result continues to hold when in addition  reservation utilities are type-dependent. This type of problem  occurs in the study of optimal compensation problems involving  competing principals. \medskip  \noindent Keywords:  Principal-agent modelling; contract design; stochastic process;  stochastic control% "
1801_03181_abstract.tex," We describe the first public data release of the Dark Energy Survey, DES DR1, consisting of reduced single-epoch images, coadded images, coadded source catalogs, and associated products and services assembled over the first three years of DES science operations. %DES DR1 is based on 345 distinct nights (August 2013 to February 2016) of optical/near-infrared imaging by the Dark Energy Camera mounted on the 4-m Blanco telescope at Cerro Tololo Inter-American Observatory in Chile. DES DR1 is based on optical/near-infrared imaging from 345 distinct nights (August 2013 to February 2016) by the Dark Energy Camera mounted on the 4-m Blanco telescope at Cerro Tololo Inter-American Observatory in Chile. We release data from the DES wide-area survey covering  $\roughly 5000 \deg^2$ of the southern Galactic cap in five broad photometric bands, $grizY$ . DES DR1 has a median delivered point-spread function of $g = \medfwhmg$ , $r = \medfwhmr$ , $i = \medfwhmi$ , $z = \medfwhmz$ , and $Y = \medfwhmy$  \asec FWHM, a photometric precision of $<1$ \% in all bands, and an astrometric precision of $\astroabs~\mas$ . % are measured relative to Gaia . %The median coadded catalog depth for \rm S/N = 10$ is $g = \maglimsnrg$ , $r = \maglimsnrr$ , $i = \maglimsnri$ , $z = \maglimsnrz$ , and $Y = \maglimsnry$  \magn. The median coadded catalog depth for a 1.95 \rm S/N = 10$ is $g = \maglimsnraperg$ , $r = \maglimsnraperr$ , $i = \maglimsnraperi$ , $z = \maglimsnraperz$ , and $Y = \maglimsnrapery$  \magn. DES DR1 includes nearly $400$ M distinct astronomical objects detected in $,000$ coadd tiles of size  $0.534 \deg^2$ produced from $,000$ individual exposures. Benchmark galaxy and stellar samples contain $\rm M$ and $\rm M$ objects, respectively, following a basic object quality selection. These data are accessible through a range of interfaces, including query web clients, image cutout servers, jupyter notebooks, and an interactive coadd image visualization tool. DES DR1 constitutes the largest photometric data set to date at the achieved depth and photometric precision. %The \nexposures individual exposures comprising DES DR1 were acquired with the Dark Energy Camera mounted on the Blanco 4-m telescope at Cerro Tololo Inter-American Observatory over 315 nights between August 2013 and February 2016. %based on the first three years of full science operations. %which are intended to support general astronomical investigations by the community. % The Dark Energy Survey (DES) %DES is a Stage II dark energy project designed to understand the origin of cosmic acceleration. %DES performs %Approximately XX survey-quality exposures were acquired with the Dark Energy Camera mounted on the %DES is designed to study the origin of cosmic acceleration using the Dark Energy Camera mounted on the Blanco 4-m telescope at Cerro Tololo Inter-American Observatory.  %by DES, a $\sim5000$ deg $^2$ imaging survey of the south Galactic cap in five optical and near-IR bands ( $grizY$ ) ultimately reaching a depth of $\sim$ 24th magnitude in the $i$ -band. % %The \nexposures individual exposures comprising DES DR1 were acquired with the Dark Energy Camera mounted on the Blanco 4-m telescope at Cerro Tololo Inter-American Observatory over 315 nights between August 2013 and February 2016. %The median delivered seeing in the $riz$ bands was ${\rm FWHM} \sim 0\farcs.9$ . %A photometric precision of $<1$ \% and astrometric precision of $\sim150$ ~mas are measured relative to Gaia . %The median coadded \magauto $S/N = 10$ depth in the $grizY$ bands is \maglimsnrg, \maglimsnrr, \maglimsnri, \maglimsnrz, and \maglimsnry \magn. %DR1 includes nearly $400$ M distinct astronomical objects detected in \roughly 10,000 coadded images produced from the individual exposures. %These data products are accessible through a range of interfaces, including an SQL web client, image cutout server, and interactive footprint search location and coadd image visualization tools. %Contemporaneously, DES performs a deep, time-domain survey in four optical bands ($g,r,i,z$ ) over $\sim 27$ square-degree. % I don't think we should emphasize the SN survey in the abstract if we are not releasing any of the associated data. %DES exposures are processed nightly with an evolving data reduction pipeline and evaluated for image quality to determine if they need to be retaken. %Difference imaging and transient source detection is also performed nightly. % Also, we are not releasing any difference imaging products, only the single-epoch detections in the incremental release of summer 2018. %On a yearly basis, DES exposures are reprocessed with a refined pipeline and coadded to maximize imaging depth. %DR1 includes $\sim400$ M distinct astronomical objects detected in the coadded images. %The median delivered $i$ -band seeing is $\sim0.9 \asec$ , photometric calibration of $\sim1$ \%, and astrometric precision of 150 mas. %Here we describe the DES image processing pipeline in support of DES science, as a reference for users of archival DES data, and as a guide for future astronomical surveys. "
1801_00778_main.tex, Quantum algorithm plays a notable role in solving linear systems of equations with an exponential speedup over the classical algorithm. Here we demonstrate Gaussian elimination method for solving system of equations by using the well known Grover's quantum search algorithm. The elimination method mainly involves elementary row operations which can be performed by applying particular matrices that can be obtained from Grover's algorithm. We explicitly illustrate the whole process by taking a simple example consisting of a set of equations.
1801_05270_Lane_manuscript.tex," We demonstrate in situ gate-tunable acoustoelectric transport in exfoliated monolayer graphene by measuring the voltage created as high-frequency surface acoustic waves dynamically drive charge carriers in the graphene. We employ a flip-chip device configuration to conduct acoustoelectric measurements while simultaneously controlling the graphene carrier density with a metal-oxide back-gate. At high carrier density we observe dependence of the acoustoelectric signal on the sign of the graphene charge carriers, while at low densities we observe anomalous sign reversals of the acoustoelectrically generated voltage. We attribute these anomalous sign reversals to spatially heterogeneous conduction in the vicinity of charge neutrality. "
1801_04076_deep.tex," Deep learning and convolutional neural networks (CNN) have been intensively used in many image processing topics during last years. As far as steganalysis is concerned, the use of CNN allows reaching the state-of-the-art results. The performances of such networks often rely on the size of their learning database. An obvious preliminary assumption could be considering that “the bigger a database is, the better the results are”. However, it appears that cautions have to be taken when increasing the database size if one desire to improve the classification accuracy i.e. enhance the steganalysis efficiency. To our knowledge, no study has been performed on the enrichment impact of a learning database on the steganalysis performance. What kind of images can be added to the initial learning set? What are the sensitive criteria: the camera models used for acquiring the images, the treatments applied to the images, the cameras proportions in the database, etc? This article continues the work carried out in a previous paper in submission Yedroudj2018_Net , and explores the ways to improve the performances of CNN. It aims at studying the effects of “base augmentation” on the performance of steganalysis using a CNN. We present the results of this study using various experimental protocols and various databases to define the good practices in base augmentation for steganalysis. "
1801_10103_FIACPO.tex," 	We investigate systems of the form $A^tg:g\in\G,t\in[0,L]\$ where $A \in B(\HH)$ is a normal operator in a separable Hilbert space $\HH$ , $\G\subset \HH$ is a countable set, and $L$ is a positive real number. Although the main goal of this work is to study the frame properties of  $A^tg:g\in\G,t\in[0,L]\$ , as intermediate steps, we explore the completeness and Bessel properties of such systems from a theoretical perspective, which are of interest by themselves. Beside the theoretical appeal of investigating such systems, their connections to dynamical and mobile sampling make them fundamental for understanding and solving several major problems in  engineering and science. "
1801_10583_ms.tex," Due to the liberalization of markets, the change in the energy mix and the surrounding energy laws, electricity research is a dynamically altering field with steadily changing challenges. One challenge especially for investment decisions is to provide reliable short to mid-term forecasts despite high variation in the time series of electricity prices. This paper tackles this issue in a promising and novel approach. By utilizing  combining the high precision of econometric autoregressive models in the short-run with  and the expectations of market participants reflected in future prices for the short- and mid-run we show that the forecasting performance can be vastly increased while maintaining hourly precision. We investigate the day-ahead electricity price of the EPEX Spot for Germany and Austria and setup a model which incorporates the Phelix future of the EEX for Germany and Austria. The model can be considered as an AR24-X model with one distinct model for each hour of the day. We are able to show that future data contains relevant price information for future time periods of the day-ahead electricity price. We show that relying only on deterministic external regressors can provide stability for forecast horizons of multiple weeks.  By implementing a fast and efficient lasso estimation approach we demonstrate that our model can outperform several other models in the literature. "
1801_08388_top.tex," Non-Rigid structure from motion ( ), is a long standing and central problem in computer vision, allowing us to obtain 3D information from multiple images when the scene is dynamic. A main issue regarding the further development of this important computer vision topic, is the lack of high quality data sets. We here address this issue by presenting of data set compiled for this purpose, which is made publicly available, and considerably larger than previous state of the art. To validate the applicability of this data set, and provide and investigation into the state of the art of  , including potential directions forward, we here present a benchmark and a scrupulous evaluation using this data set. This benchmark evaluates 16 different methods with available code, which we argue reasonably spans the state of the art in  . We also hope, that the presented and public data set and evaluation, will provide benchmark tools for further development in this field. "
1801_07197.tex," We show that, for a finitely generated residually finite group $\Gamma$ , the word $[x_1, \ldots, x_k]$ is a probabilistic identity of $\Gamma$ if and only if $\Gamma$ is virtually nilpotent of class less than $k$ . Related results, generalizations and problems are also discussed. "
1801_02665_Symbolic_relative_entropy_in_equalities-involved_heartbeats.tex," Symbolic relative entropy, an efficient nonlinear complexity parameter measuring probabilistic divergences of symbolic sequences, is proposed in our nonlinear dynamics analysis of heart rates considering equal states. Equalities are not rare in discrete heartbeats because of the limits of resolution of signals collection, and more importantly equal states contain underlying important cardiac regulation information which is neglected by some chaotic deterministic parameters and temporal asymmetric measurements. The relative entropy of symbolization associated with equal states has satisfied nonlinear dynamics complexity detections in heartbeats and shows advantages to some nonlinear dynamics parameters without considering equalities. Researches on cardiac activities suggest the highest probabilistic divergence of the healthy young heart rates and highlight the facts that heart diseases and aging reduce the nonlinear dynamical complexity of heart rates. "
1801_03844_main.tex,"  In this paper, we explore the usage of Word Embedding semantic resources for Information Retrieval (IR) task. This embedding, produced by a shallow neural network, have been shown to catch semantic similarities between words article6 . Hence, our goal is to enhance IR Language Models by addressing the term mismatch problem. To do so, we applied the model presented in the paper Integrating and Evaluating Neural Word Embedding in Information Retrieval by article2 that proposes to estimate the translation probability of a Translation Language Model using the cosine similarity between Word Embedding. The results we obtained so far did not show a statistically significant improvement compared to classical Language Model.   Information Retrieval, Language Model , Word Embedding "
1801_09964_paper-v2.tex," 1cm Due to the absence of well-defined concepts of time and energy in background independent systems, formulating statistical equilibrium in such settings remains an open issue. Even more so in the full quantum gravity context, not based on any of the usual spacetime notions but on non-spatiotemporal degrees of freedom. In this paper, after having clarified different general notions of statistical equilibrium, on which different construction procedures can be based, we focus on the group field theory formalism for quantum gravity, whose technical features prove advantageous to the task. We use the operatorial formulation of group field theory to define its statistical mechanical framework, and, based on this, we construct three concrete examples of Gibbs states. The first is a Gibbs state with respect to a geometric volume operator, which is shown to support condensation to a low-spin phase. This state is not based on a pre-defined flow and its construction is via Jaynes' entropy maximisation principle. The second are Gibbs states encoding structural equilibrium with respect to internal translations on the GFT base manifold, and defined via the KMS condition. The third are Gibbs states encoding relational equilibrium with respect to a clock Hamiltonian, obtained by deparametrization with respect to coupled scalar matter fields. "
1801_09094_DDM_layered_7.tex,"  We develop a non-overlapping domain decomposition method (DDM) for the solution of quasi-periodic scalar transmission problems in layered media. Our approach relies on robust boundary-integral equation formulations of Robin-to-Robin (RtR) maps throughout the frequency spectrum, including at Wood, or cutoff, frequencies.  We overcome the obstacle of non-convergent quasi-periodic Green functions at these frequencies by incorporating newly introduced shifted quasi-periodic Green functions. Using the latter in the definition of our quasi-periodic boundary-integral operators leads to rigorously stable computations of RtR operators. We develop Nystr \""om discretizations of the RtR maps that rely on trigonometric interpolation, singularity resolution, and fast convergent windowed quasi-periodic Green functions. We solve the tridiagonal DDM system via recursive Schur complements and we establish rigorously that this procedure is always completed successfully. We present a variety of numerical results concerning Wood frequencies in two and three dimensions as well as large numbers of layers.  % \newline   Keywords : Helmholtz transmission problem, domain decomposition, periodic layered media, lattice sum.\\    AMS subject classifications :  65N38, 35J05, 65T40,65F08 "
1801_02969_Iterative_Learning_Economic_MPC_1-column_.tex," 		An iterative learning based economic model predictive controller (ILEMPC) is proposed for repetitive tasks in this paper. Compared with existing works, the initial feasible trajectory of the proposed ILEMPC is not restricted to be convergent to an equilibrium so it can handle various types of control objectives: stabilization, tracking a periodic trajectory and even pure economic optimization. The controller can learn from the previous closed-loop trajectory, resulting in a performance which is guaranteed to be no worse than the previous one. Under some standard assumptions in model predictive control, we show that recursive feasibility is ensured. Furthermore, for stabilization problem, the convergence of each learned trajectory and the learning process are established provided the initial trajectory is convergent. Numerical examples show that the proposed control strategy works well for different types of control tasks and systems. 		 	"
1801_07000_ImprovingPFforHDproblemsUsingArtificialProcessNoise.tex,"         		The particle filter is one of the most successful methods for state inference and identification of general non-linear and non-Gaussian models. However, standard particle filters suffer from degeneracy of the particle weights for high-dimensional problems. We propose a method for improving the performance of the particle filter for certain challenging state space models, with implications for high-dimensional inference. First we approximate the model by adding artificial process noise in an additional state update, then we design a proposal that combines the standard and the locally optimal proposal. This results in a bias-variance trade-off, where adding more noise reduces the variance of the estimate but increases the model bias. The performance of the proposed method is evaluated on a linear Gaussian state space model and on the non-linear Lorenz'96 model. For both models we observe a significant improvement in performance over the standard particle filter. 	"
1801_07756_main.tex," In recent years, the use of deep learning algorithms has become increasingly more prominent. Within the field of electromyography-based gesture recognition however, deep learning algorithms are seldom employed. This is due in part to the large quantity of data required for the network to train on. The data sparsity arises from the fact that it would take an unreasonable amount of time for a single person to generate tens of thousands of examples for training such algorithms. In this paper, two datasets are recorded with the Myo Armband (Thalmic Labs), a low-cost, low-sampling rate (200 Hz ), 8-channel, consumer-grade, dry electrode sEMG armband. These datasets, referred to as the pre-training and evaluation dataset, are comprised of 19 and 17 able-bodied participants respectively. A convolutional network (ConvNet) is augmented with transfer learning techniques to leverage inter-user data from the first dataset, alleviating the burden imposed on a single individual to generate a vast quantity of training data for sEMG-based gesture recognition. This transfer learning scheme is shown to outperform the current state-of-the-art in gesture recognition achieving an average accuracy of 98.31 \% for 7 hand/wrist gestures over 17 able-bodied participants. Finally, a use-case study of eight able-bodied participants is presented to evaluate the impact of feedback on the degradation accuracy normally experienced from a classifier over time.  "
1801_01269_manuscript.tex," When two planar atomic membranes are placed within the van der Waals distance, the charge and heat transport across the interface are coupled by the rules of momentum conservation and structural commensurability, lead to outstanding thermoelectric properties. Here we show that an effective 'inter-layer phonon drag' determines the Seebeck coefficient ( $S$ ) across the van der Waals gap formed in twisted bilayer graphene (tBLG). The cross-plane thermovoltage which is nonmonotonic in both temperature and density, is generated through scattering of electrons by the out-of-plane layer breathing (ZO $^{'}$ /ZA $_{2}$ ) phonon modes and differs dramatically from the expected Landauer-Buttiker formalism in conventional tunnel junctions. The Tunability of cross-plane seebeck effect in van der Waals junctions may be valuable in creating a new genre of versatile thermoelectric systems with layered solids "
1801_04448_main.tex," Recently, it was shown both theoretically and experimentally that certain three-dimensional (3D) materials have Dirac points in the Brillouin zone, thus being 3D analogs of graphene. Moreover, it was suggested that under specific conditions a pair of adatoms placed inside a three-dimensional Dirac semimetal may lead to the formation of an unusual antibonding state. However, in any realistic system vibrational degrees of freedom play an important role. In this work we address the influence of phonons on characteristic features of (anti)bonding state, and discuss how these results can be tested experimentally via local probing, namely inelastic electron tunneling spectroscopy that is known to be linked to $d^2I/dV^2$ curve obtained in STM measurements. "
1801_01040_main-submit.tex,"\abstract{ Interplanetary (IP) shocks are known to be accelerators of energetic charged particles observed in-situ in the heliosphere. However, the acceleration of near-relativistic electrons by shocks in the interplanetary medium is often questioned. On 9 August 2011 a Corotating Interaction Region (CIR) passed STEREO B (STB) that resulted in a flux increase in the electron and ion channels of the Solar Electron and Proton Telescope (SEPT). Because electron measurements in the few~keV to several 100~keV range rely on the so-called magnet foil technique, which is utilized by SEPT, ions can contribute to the electron channels.}"
1801_07430_Cache-NOMA_CCNC2018_test_version.tex," 	Non-Orthogonal Multiple Access (NOMA) and caching are two proposed approaches to increase the capacity of future 5G wireless systems. Typically in NOMA systems, signals at the receiver are decoded using successive interference cancellation in order to achieve capacity in multi-user systems. The leveraging of caching in the physical layer to further improve on the benefits of NOMA is investigated, which is termed cache-aided NOMA. Specific attention is given to the caching cases where the users with weaker channel conditions possess a cache of the information requested by a user with a stronger channel condition. The probability that any of the users is in outage for any of the rates required for this NOMA system, defined as the ""union-outage,"" is derived for the case of fixed-power allocation, and the power allocation strategy that minimizes the union-outage probability is derived. Simulation results confirm the analytical results, which demonstrate the benefits of cache-aided NOMA on reducing the union-outages probability.   "
1801_01928_main.tex," Tensor Train decomposition is used across many branches of machine learning, but until now it lacked an implementation with GPU support, batch processing, automatic differentiation, and versatile functionality for Riemannian optimization framework, which takes in account the underlying manifold structure in order to construct efficient optimization methods. In this work, we propose a library that aims to fix it and makes machine learning papers that rely on Tensor Train decomposition easier to implement. The library includes $92\%$ test coverage, examples, and API reference documentation. "
