old_file,abstract
1801_09870_main.tex," We propose a new method to efficiently compute load-flows (the steady-state of the power-grid for given productions, consumptions and grid topology), substituting conventional simulators based on differential equation solvers. We use a deep feed-forward neural network trained with load-flows precomputed by simulation. Our architecture permits to train a network on so-called ``n-1'' problems, in which load flows are evaluated for every possible line disconnection, then generalize to ``n-2'' problems without re-training (a clear advantage because of the combinatorial nature of the problem). To that end, we developed a technique bearing similarity with ``dropout'', which we named ``guided dropout''. "
1801_09774_main.tex," We present a psychoacoustically enhanced cost function to balance network complexity and perceptual performance of deep neural networks for speech denoising. While training the network, we utilize perceptual weights added to the ordinary mean-squared error to emphasize contribution from frequency bins which are most audible while ignoring error from inaudible bins. To generate the weights, we employ psychoacoustic models to compute the global masking threshold from the clean speech spectra. We then evaluate the speech denoising performance of our perceptually guided neural network by using both objective and perceptual sound quality metrics, testing on various network structures ranging from shallow and narrow ones to deep and wide ones. The experimental results showcase our method as a valid approach for infusing perceptual significance to deep neural network operations. In particular, the more perceptually sensible enhancement in performance seen by simple neural network topologies proves that the proposed method can lead to resource-efficient speech denoising implementations in small devices without degrading the perceived signal fidelity. "
1801_09179.tex," A particular case of the Hindman--Galvin--Glazer theorem states that, for every partition of an infinite abelian group $G$ into two cells, there will be an infinite $X\subseteq G$ such that the set of its finite sums $x_1+\cdots+x_n \mid n\in\mathbb N\wedge x_1,\ldots,x_n\in X\text{ are distinct\}$ is monochromatic. It is known that the same statement is false, in a very strong sense, if one attempts to obtain an uncountable (rather than just infinite) $X$ . On the other hand, a recent result of Komj \'ath states that, for partitions into uncountably many cells, it is possible to obtain monochromatic sets of the form $\fs(X)$ , for $X$ of some prescribed finite size, when working with sufficiently large Boolean groups. In this paper, we provide a generalization of Komj \'ath's result, and we show that, in a sense, this generalization is the strongest possible. "
1801_01024_NA4_versao_7.tex," We study solutions for the Klein--Gordon equation with vector and scalar potentials of the Coulomb types under the influence of non-inertial effects in the space-time of topological defects. We also investigate a quantum particle described by the Klein--Gordon oscillator in the background space-time generated by a string. An important result obtained is that the non-inertial effects restrict the physical region of the space-time where the particle can be placed. In addition, we show that these potentials can form bound states for the relativistic wave equation equation in this kind of background. "
1801_07753_aanda.tex,{}{}{}{}
1801_02635_paper_draft.tex," We present the first rest-frame UV population study of 17 heavily reddened, high-luminosity (E(B-V) $_{QSO}\gtrsim$ 0.5; L $_{bol}>$ 10 $^{46}$ ergs $^{-1}$ ) broad-line quasars at $1.5 < z < 2.7$ . We combine the first year of deep, optical, ground-based observations from the Dark Energy Survey (DES) with the near infrared VISTA Hemisphere Survey (VHS) and UKIDSS Large Area Survey (ULAS) data, from which the reddened quasars were initially identified. We demonstrate that the significant dust reddening towards the quasar in our sample allows host galaxy emission to be detected at the rest-frame UV wavelengths probed by the DES photometry. By exploiting this reddening effect, we disentangle the quasar emission from that of the host galaxy via spectral energy distribution (SED) fitting. We find evidence for a relatively unobscured, star-forming host galaxy in at least ten quasars, with a further three quasars exhibiting emission consistent with either star formation or scattered light. From the rest-frame UV emission, we derive instantaneous, dust-corrected star formation rates (SFRs) in the range 25 < SFR $_{UV}$ < 365 M $_{\odot}$ yr $^{-1}$ , with an average SFR $_{UV}$ = 130 $\pm$ 95 M $_{\odot}$ yr $^{-1}$ . We find a broad correlation between SFR $_{UV}$ and the bolometric quasar luminosity. Overall, our results show evidence for coeval star formation and black hole accretion occurring in luminous, reddened quasars at the peak epoch of galaxy formation.   "
1801_08203_Complete_Classification_of_Discrete_specializations_of_the_Burau_representation_of_B3.tex," This classification is found by analyzing the action of a normal subgroup of $B_3$ as hyperbolic isometries. This paper gives an example of an unfaithful specialization of the Burau representation on $B_4$ that is faithful when restricted to $B_3$ , as well as examples of unfaithful specializations of $B_3$ . "
1801_06152_BRITEproceedingsMMunoz.tex," All known Galactic Of?p stars have been shown to host strong, organized, magnetic fields. Recently, five Of?p stars have been discovered in the Magellanic Clouds. They posses photometric Naze and spectroscopic Walborn variability compatible with the Oblique Rotator Model (ORM). However, their magnetic fields have yet to be directly detected. We have developed an algorithm allowing for the synthesis of photometric observables based on the Analytic Dynamical Magnetosphere (ADM) model of Owocki . We apply our model to OGLE photometry in order to constrain their magnetic geometries and and surface dipole strengths. We predict that the field strengths for some of these candidate extra-Galactic magnetic stars may be within the detection limits of the FORS2 instrument. "
1801_01837_ms.tex," We present high-precision timing data over timespans of up to 11 years for 45 millisecond pulsars observed as part of the North American Nanohertz Observatory for Gravitational Waves (NANOGrav) project, aimed at detecting and characterizing low-frequency gravitational waves. The pulsars were observed with the Arecibo Observatory and/or the Green Bank Telescope at frequencies ranging from 327 MHz to 2.3 GHz. Most pulsars were observed with approximately monthly cadence, with six high--timing-precision pulsars observed weekly, and all were observed at widely separated frequencies at each observing epoch in order to fit for time-variable dispersion delays. We describe our methods for data processing, time-of-arrival (TOA) calculation, and the implementation of a new, automated method for removing outlier TOAs. We fit a timing model for each pulsar which includes spin, astrometric, and, if necessary, binary parameters, in addition to time-variable dispersion delays and parameters that quantify pulse-profile evolution with frequency. The new timing solutions provide three new parallax measurements, two new Shapiro-delay measurements, and two new measurements of large orbital-period variations. We fit models that characterize sources of noise for each pulsar. We find that 11 pulsars show significant red noise, with generally smaller spectral indices than typically measured for non-recycled pulsars, possibly suggesting a different origin. Future papers will use these data to constrain or detect the signatures of gravitational-wave signals.  "
1801_04916_ms.tex," This paper is a follow-up work about the artificial ecosystem model: number soup (Liu and Sumpter, J. Royal Soc. Interface , 2017). It elaborates more details about this model and points out future directions. "
1801_05281_search-high-z_15jan.tex," Ultra-steep spectrum (USS) radio sources are good tracers of powerful radio galaxies at $z > 2$ . Identification of even a single bright radio galaxy at $z > 6$ can be used to detect redshifted 21cm absorption due to neutral hydrogen in the intervening IGM. Here we describe a new sample of high-redshift radio galaxy (HzRG) candidates constructed from the TGSS ADR1 survey at 150 MHz. We employ USS selection ( $\alpha \le -1.3$ ) in $\sim10000$ square degrees, in combination with strict size selection and non-detections in all-sky optical and infrared surveys. We apply flux density cuts that probe a unique parameter space in flux density ( $50 < S_{150} < 200$ mJy) to build a sample of 32 HzRG candidates. Follow-up Karl G. Jansky Very Large Array (VLA) observations at 1.4 GHz with an average beam size of $1.3$ arcseconds ( $''$ ) revealed $\sim 48\%$ of sources to have a single radio component. P-band (370 MHz) imaging of 17 of these sources revealed a flattening radio SED for ten sources at low frequencies, which is expected from compact HzRGs. Two of our sources lie in fields where deeper multi-wavelength photometry and ancillary radio data are available and for one of these we find a best-fit photo-z of $4.8 \pm 2.0$ . The other source has $z_{phot}=1.4 \pm 0.1$ and a small angular size ( $3.7''$ ), which could be associated with an obscured star forming galaxy or with a `dead' elliptical. One USS radio source not part of the HzRG sample but observed with the VLA nonetheless is revealed to be a candidate giant radio galaxy with a host galaxy photo-z of $1.8\pm0.5$ , indicating a size of 875 kpc. "
1801_08638.tex," We study representations of the meromorphic open-string vertex algebra (MOSVAs hereafter) defined in H-MOSVA , a noncommutative generalization of vertex (operator) algebra. We start by recalling the definition of a MOSVA $V$ and left $V$ -modules in H-MOSVA . Then we define right $V$ -modules and $V$ -bimodules that reflect the noncommutative nature of $V$ . When $V$ satisfies a condition on the order of poles of the correlation function (which we call pole-order condition), we prove that the rationality of products of two vertex operators implies the rationality of products of any numbers of vertex operators. Also, the rationality of iterates of any numbers of vertex operators is established, and is used to construct the opposite MOSVA $V^{op}$ of $V$ . It is proved here that right (resp. left) $V$ -modules are equivalent to left (resp. right) $V^{op}$ -modules. Using this equivalence, we prove that if $V$ and a grading-restricted left $V$ -module $W$ is endowed with a M \""obius structure, then the graded dual $W'$ of $W$ is a right $V$ -module. This proof is the only place in this paper that needs the grading-restriction condition. Also, this result is generalized to not-grading-restricted modules under a strong pole-order condition that is satisfied by all existing examples of MOSVAs and modules. "
1801_07058_poincare.tex," We propose a general strategy to derive null-homotopy operators for differential complexes based on the Bernstein-Gelfand-Gelfand (BGG) construction and properties of the de Rham complex. Focusing on the elasticity complex, we derive path integral operators $P$ for elasticity satisfying $DP+PD=id$ and $P^{2}=0$ , where the differential operators $D$ correspond to the linearized deformation, the linearized curvature and the divergence, respectively. As a special case, we rederive the classical Ces a ro-Volterra path integral for strain tensors satisfying the Saint Venant compatibility condition, using the path integral for scalar potentials and techniques from homological algebra. The known path-independence of the Ces a ro-Volterra path integral can thus be seen as a result of the corresponding property of differential 1-forms.  {In general we derive path integral formulas in the presence of defects.} "
1801_07887_paper.tex," When using active learning, smaller batch sizes are typically more efficient from a learning efficiency perspective. However, in practice due to speed and human annotator considerations, the use of larger batch sizes is necessary. While past work has shown that larger batch sizes decrease learning efficiency from a learning curve perspective, it remains an open question how batch size impacts methods for stopping active learning. We find that large batch sizes degrade the performance of a leading stopping method over and above the degradation that results from reduced learning efficiency. We analyze this degradation and find that it can be mitigated by changing the window size parameter of how many past iterations of learning are taken into account when making the stopping decision. We find that when using larger batch sizes, stopping methods are more effective when smaller window sizes are used. "
1801_01394_TrexTheory.tex," The TREX is a recently introduced approach to sparse linear regression. In contrast to most well-known approaches to penalized regression, the TREX can be formulated without the use of tuning parameters.  %Recent work has shown that the TREX can be efficiently computed despite being based on a non-convex optimization problem. In this paper, we establish the first known prediction error bounds for the TREX. Additionally, we introduce extensions of the TREX to a more general class of penalties, and we provide a bound on the prediction error in this generalized setting. These results deepen the understanding of TREX from a theoretical perspective and provide new insights into penalized regression in general. TREX \and high-dimensional regression \and tuning parameters \and oracle inequalities  62J07 "
1801_08553_NPDDE_v9.tex," We explore cosmological constraints on the sum of the three active neutrino masses $\mnu$ in the context of dynamical dark energy (DDE) models with equation of state (EoS) parametrized as a function of redshift $z$ by  $w(z)=w_0+w_a\,z/(1+z)$ , and satisfying $w(z)\geq-1$ for all $z$ . We make use of Cosmic Microwave Background data from the Planck satellite, Baryon Acoustic Oscillations measurements, and Supernovae Ia luminosity distance measurements, and perform a Bayesian analysis. We show that, within these models, the bounds on $\mnu$  do not degrade with respect to those obtained in the $\lcdm$ case; in fact the bounds are slightly tighter, despite the enlarged parameter space. We explain our results based on the observation that, for fixed choices of $w_0\,,w_a$ such that $w(z)\geq-1$ (but not $w=-1$ for all $z$ ), the upper limit on $\mnu$ is tighter than the $\lcdm$ limit because of the well-known degeneracy between $w$ and $M_{\nu}$ . The Bayesian analysis we have carried out then integrates over the possible values of $w_0$ - $w_a$ such that $w(z)\geq-1$ , all of which correspond to tighter limits on $M_\nu$ than the $\lcdm$ limit. We find a 95 \% confidence level (C.L.) upper bound of $\mnu<0.13\,\eV$ . This bound can be compared with $\mnu<0.16\,\eV$ at 95 \%~C.L., obtained within the $\lcdm$ model, and $\mnu<0.41\,\eV$ at 95 \%~C.L., obtained in a DDE model with arbitrary EoS (which allows values of $w < -1$ ). Contrary to the results derived for DDE models with arbitrary EoS, we find that a dark energy component with $w(z)\geq-1$ is unable to alleviate the tension between high-redshift observables and direct measurements of the Hubble constant $H_0$ . Finally, in light of the results of this analysis, we also discuss the implications for DDE models of a possible determination of the neutrino mass hierarchy by laboratory searches. "
1801_08829_ieee_shonan.tex," Symbol emergence through a robot's own interactive exploration of the world without human intervention has been investigated now for several decades. However, methods that enable a machine to form symbol systems in a robust bottom-up manner are still missing. Clearly this shows that we still do not have an appropriate computational understanding that explains symbol emergence in biological and artificial systems. Over the years it became more and more clear that symbol emergence has to be posed as a multi-facetted problem. Therefore, we will first review the history of the symbol emergence problem in different fields showing their mutual relations. Then we will describe recent work and approaches to solve this problem with the aim of providing an integrative and comprehensive overview of symbol emergence for future research. "
1801_03164_abstract.tex," In this paper, we present \system, a parallel anomaly dataset generator. We discuss its design and provide brief experimental results demonstrating its usefulness in improving the classification correctness of LSTM-AD, a state-of-the-art anomaly detection model. "
1801_09613_Euler_problem_MartynchukDullinEfstathiouWaalkens.tex,"  The problem of two fixed centers was introduced by Euler as early as in 1760. It plays an important role both in celestial mechanics and in the microscopic world. In the present paper we study the spatial  problem in the case of arbitrary (both positive and negative) strengths of the centers. Combining techniques from scattering theory and Liouville integrability,  we show that this spatial problem has  topologically non-trivial scattering dynamics, which we identify as scattering monodromy.  The approach that we introduce in this paper applies more generally  to scattering systems that are integrable in the Liouville sense.\\  %Our approach is based on techniques from the theory of Liouville integrable systems and scattering theory.   -2mm  \\  Keywords: Action-angle coordinates; Hamiltonian systems; Liouville integrability; Scattering map; Scattering monodromy. "
1801_02727_gapsdscuti.tex,{}{}{}{}
1801_01211_RMF-revised.tex," \bf Abstract: We study the generation of an electromagnetic current in monolayer graphene immersed in a weak perpendicular magnetic field and radiated with linearly polarized monochromatic light. Such a current emits Bremsstrahlung radiation with the same amplitude above and below the plane of the sample, in the latter case consistent with the small amount of light absorption in the material. This mechanism could be an important contribution for the reflexion of light phenomenon in graphene.   \bf Resumen: Estudiamos la generaci \'on de una corriente electromagn \'etica en una monocapa de grafeno inmersa en un campo magn \'etico d \'ebil perpendicular y radiada con luz monocrom \'atica. Esta corriente emite radiaci \'on de Bremsstrahlung con la misma amplitud por arriba y abajo del plano de la muestra, en el \'ultimo caso consistente con la peque \~na cantidad de absorci \'on de luz en el material. Este mecanismo puede ser una contribuci \'on importante para el fen \'omeno de reflexi \'on de luz en grafeno. "
1801_04867_MousleyRussell_Morse_boundary_HHG_final.tex,"\abstract{We generalize a result of Paulin on the Gromov boundary of hyperbolic groups to the Morse boundary of proper, maximal hierarchically hyperbolic spaces admitting cocompact group actions by isometries. Namely we show that if the Morse boundaries of two such spaces each contain at least three points, then the spaces are quasi-isometric if and only if there exists a 2--stable, quasi-m\""obius homeomorphism between their Morse boundaries. Our result extends a recent result of Charney--Murray, who prove such a classification for CAT(0) groups, and is new for mapping class groups and the fundamental groups of $3$--manifolds without Nil or Sol components.}"
1801_09589_main.tex," Subnetwork extraction using community detection methods is commonly used to study the brain's modular structure. Recent studies indicated that certain brain regions are known to interact with multiple subnetworks. However, most existing methods are mainly for non-overlapping subnetwork extraction. In this paper, we present an approach for overlapping brain subnetwork extraction using cliques, which we defined as co-activated node groups performing multiple tasks. We proposed a multisource subnetwork extraction approach based on the co-activated clique , which (1) uses task co-activation and task connectivity strength information for clique identification, (2) automatically detects cliques of different sizes having more neuroscientific justifications, and (3) shares the subnetwork membership, derived from a fusion of rest and task data, among the nodes within a clique for overlapping subnetwork extraction. On real data, compared to the commonly used overlapping community detection techniques, we showed that our approach improved subnetwork extraction in terms of group-level and subject-wise reproducibility. We also showed that our multisource approach identified subnetwork overlaps within brain regions that matched well with hubs defined using functional and anatomical information, which enables us to study the interactions between the subnetworks and how hubs play their role in information flow across different subnetworks. We further demonstrated that the assignments of interacting/individual nodes using our approach correspond with the posterior probability derived independently from our multimodal random walker based approach. Keywords: Clique, Overlapping Brain Subnetwork Extraction, Multisource Fusion, Functional Connectivity, Hypergraph "
1801_01822_basal_ganglia1.tex," Parkinsonism leads to various electrophysiological changes in the basal ganglia-thal \-amo \-cort \-ical system (BGTCS), often including elevated discharge rates of the subthalamic nucleus (STN) and the output nuclei, and reduced activity of the globus pallidus external segment (GPe). These rate changes have been explained qualitatively in terms of the direct/indirect pathway model, involving projections of distinct striatal populations to the output nuclei and GPe. Although these populations partly overlap, evidence suggests dopamine depletion differentially affects cortico-striato-pallidal connection strengths to the two pallidal segments. Dopamine loss may also decrease the striatal signal-to-noise ratio, reducing both corticostriatal coupling and striatal firing thresholds. Additionally, nigrostriatal degeneration may cause secondary changes including weakened lateral inhibition in the GPe, and mesocortical dopamine loss may decrease intracortical excitation and especially inhibition. Here a mean-field model of the BGTCS is presented with structure and parameter estimates closely based on physiology and anatomy. Changes in model rates due to the possible effects of dopamine loss listed above are compared with experiment. Our results suggest that a stronger indirect pathway, possibly combined with a weakened direct pathway, is compatible with empirical evidence. However, altered corticostriatal connection strengths are probably not solely responsible for substantially increased STN activity often found. A lower STN firing threshold, weaker intracortical inhibition, and stronger striato-GPe inhibition help explain the relatively large increase in STN rate. Reduced GPe-GPe inhibition and a lower GPe firing threshold can account for the comparatively small decrease in GPe rate frequently observed. Changes in cortex, GPe, and STN help normalize the cortical rate, also in accord with experiments. The model integrates the basal ganglia into a unified framework along with an existing thalamocortical model that already accounts for a wide range of electrophysiological phenomena. A companion paper discusses the dynamics and oscillations of this combined system. "
1801_06223_ms_pfvv.tex,"\abstract{ A range of astronomical data indicates that ancient  supernovae created the galactic environment of the Sun and sculpted  the physical properties of the interstellar medium near the  heliosphere. In this paper we review the characteristics of the  local interstellar medium that have been affected by supernovae.  The kinematics, magnetic field, elemental abundances, and  configuration of the nearest interstellar material support the view  that the Sun is at the edge of the Loop I superbubble, which has  merged into the low density Local Bubble. The energy source for the  higher temperature X-ray emitting plasma pervading the Local Bubble  is uncertain. Winds from massive stars and nearby supernovae,  perhaps from the Sco-Cen Association, may have contributed  radioisotopes found in the geologic record and galactic cosmic ray  population. Nested supernova shells in the Orion and Sco-Cen  regions suggest spatially distinct sites of episodic star formation.  The heliosphere properties vary with the pressure of the surrounding  interstellar cloud. A nearby supernova would modify this pressure   equilibrium and thereby severely disrupt the heliosphere as well  as the local interstellar medium. }"
1801_10206.tex," For a stationary spacetime metric, black holes are spatial regions which disturbances may not propagate out of. In our previous work an existence and regularity theorem was proven for black holes in two space dimensions, in the case where the boundary of the ergoregion is a simple closed curve surrounding a singularity. In this paper we study the case of an annular ergoregion, whose boundary has two components. "
