old_file,abstract
1801_08912_ACC_2018v2.tex," We study the problem of collaboratively estimating the state of an LTI system monitored by a network of sensors, subject to the following important practical considerations: (i) certain sensors might be arbitrarily compromised by an adversary and (ii) the underlying communication graph governing the flow of information across sensors might be time-varying. We first analyze a scenario involving intermittent communication losses that preserve certain information flow patterns over bounded intervals of time. By equipping the sensors with adequate memory, we show that one can obtain a fully distributed, provably correct state estimation algorithm that accounts for arbitrary adversarial behavior, provided certain conditions are met by the network topology. We then argue that our approach can handle bounded communication delays as well. Next, we explore a case where each communication link stochastically drops packets based on an analog erasure channel model. For this setup, we propose state estimate update and information exchange rules, along with conditions on the network topology and packet drop probabilities, that guarantee mean-square stability despite arbitrary adversarial attacks. "
1801_04430_main.tex," We explore nonlinear transitions of polariton wavepackets, first, to a soliton and then to a standing wave polariton condensate in a multi-mode microwire system. At low polariton density we observe ballistic propagation of the multi-mode polariton wavepackets arising from the interference between different transverse modes. With increasing polariton density, the wavepackets transform into single mode bright solitons due to effects of both inter-modal and intra-modal polariton-polariton scattering. Further increase of the excitation density increases thermalisation speed leading to relaxation of the polariton density distribution in momentum space with the resultant formation of a non-equilibrium condensate manifested by a standing wave pattern across the whole sample. "
1801_07772_ijcnlp2017.tex," While neural machine translation (NMT) models  provide improved translation quality in an elegant, end-to-end  framework, it is less clear what they  learn about language.  Recent work has started evaluating the quality of vector representations learned by NMT models on morphological and syntactic tasks.  In this paper, we investigate the representations learned at different layers of NMT encoders. We train NMT systems on parallel data and use the trained %  models to extract features for training a classifier on two tasks: part-of-speech and semantic tagging. We then measure the performance of the classifier as a proxy to the quality of the original NMT model for the given task. Our quantitative analysis yields interesting insights regarding representation learning in NMT models. For instance, we find that higher layers are better at learning semantics while lower layers  tend to be better for part-of-speech tagging. We also observe little effect of the target language on source-side representations, especially with higher quality NMT models. Our code is available at \url{https://github.com/boknilev/nmt-repr-analysis.} "
1801_04860_31865_corr.tex,"\abstract{We investigate the star formation history and the dust attenuation in the galaxy merger Mrk848. Thanks to the multiwavelength photometry from the ultraviolet (UV) to the infrared (IR), and MaNGA's integral field spectroscopy, we are able to study this merger in a detailed way. We divide the whole merger into the core and tail regions, and fit both the optical spectrum and the multi-band spectral energy distribution (SED) to models to obtain the star formation properties for each region respectively. We find that the color excess of stars in the galaxy $E(B-V)_s^{\rm SED}$ measured with the multi-band SED fitting is consistent with that estimated both from the infrared excess (the ratio of IR to UV flux) and from the slope of the UV continuum. Furthermore, the reliability of the $E(B-V)_s^{\rm SED}$ is examined with a set of mock SEDs, showing that the dust attenuation of the stars can be well constrained by the UV-to-IR broadband SED fitting. The dust attenuation obtained from optical continuum $E(B-V)_s^{\rm spec}$ is only about half of $E(B-V)_s^{\rm spec$ to the $E(B-V)_g$ obtained from the Balmer decrement is consistent with the local value (around 0.5). The difference between the results from the UV-to-IR data and the optical data is consistent with the picture that younger stellar populations are attenuated by an extra dust component from the birth clouds compared to older stellar populations which are only attenuated by the diffuse dust.  Both with the UV-to-IR SED fitting and the spectral fitting, we find that there is a starburst younger than 100~Myr in one of the two core regions, consistent with the scenario that the interaction-induced gas inflow can enhance the star formation in the center of galaxies.} "
1801_03544_novak_proc_bgl2017.tex,"\abstract{Bose-Einstein correlations of identical hadrons reveal information about hadron creation from the strongly interacting matter formed in ultrarelativistic heavy ion collisions. The measurement of three-particle correlations may in particular shed light on hadron creation mechanisms beyond thermal/chaotic emission. In this paper we show the status of PHENIX measurements of three pion correlations as a function of momentum differences within the triplets. We analyze the shape of the correlation functions through the assumption of L\'evy sources and a proper treatment of the Coulomb interaction within the triplets. We measure the three-particle correlation strength ($\lambda_3$), which, together with the two-particle correlation strength $\lambda_2$, encodes information about hadron creation mechanisms. From a consistent analysis of two- and three-particle correlation strength we establish a new experimental measure of thermalization and coherence in the source. }"
1801_05564_ICITC-JOH.tex," We analyze socialbots active tweeting in relation to Juan Orlando Hern \em Botometer the recently re-elected president of Honduras. We find a clear bimodal separation between humans and bots, using  and its classifiers. Around one hundred separate communities of socialbots are identified and visualized, detected through the analysis of temporally coordinated retweets.  social network analysis, socialbots, elections, Spanish, Honduras "
1801_01156_elsarticle-template.tex," Most of the non-linear transceivers, which are based on Tomlinson Harashima (TH) precoding and have been proposed in the literature for two-way relay networks, assume perfect channel state information (CSI). In this paper, we propose a novel and robust TH precoding scheme for two-way relay networks with multiple antennas at the transceiver and the relay nodes. We assume imperfect CSI and that the channel uncertainty is bounded by a spherical region. Furthermore, we consider the sum of the mean square error as the objective function, under a limited power constraint for transceiver and relay nodes. Simulations are provided to evaluate the performance and to validate the efficiency of the proposed scheme. "
1801_04949_main.tex," We present a study of the M dwarf exoplanetary systems forthcoming from NASA's {\it TESS} mission. While the mission's footprint is too complex to be characterized by a single detection completeness, we extract an ensemble completeness function that recovers the M dwarf planet detections from previous work. We employ this completeness function, together with a dual-population planet occurrence model that includes compact multiple planetary systems, to infer anew the planet yield. We predict both the number of M dwarf planets likely from {\it TESS} and their system architectures. We report four main findings: first, that {\it TESS} will likely detect more planets orbiting M dwarfs that previously predicted. Around stars with spectral types between M1V--M4V, we predict {\it TESS} will find 990 $\pm$ 350 planets orbiting 715 $\pm$ 255 stars, a 1.5-fold increase over previous predictions. Secondly, {\it TESS} will find two or more transiting planets around 20 \it Kepler of these host stars, a number similar to the multiplicity yield of NASA's  mission. Thirdly, {\it TESS} light curves in which one or more planets are detected will often contain transits of additional planets below the detection threshold of {\it TESS} . Among a typical set of 200 {\it TESS} hosts to one or more detected planets, 116 $\pm$ 28 transiting planets will be missed. Transit follow-up efforts with the photometric sensitivity to detect an Earth or larger around a mid-M dwarf, even with very modest period completeness, will readily result in additional planet discoveries. And fourth, the strong preference of {\it TESS} for systems of compact multiples indicates that {\it TESS} planets will be dynamically cooler on average than {\it Kepler} planets, with 90 \it TESS of  planets residing in orbits with $e<0.15$ . "
1801_04638.tex," For a variety of finite groups $\bH$ , let $\bHbar$ denote the variety of finite semigroups all of whose subgroups lie in $\bH$ . We give a characterization of the subsets of a finite semigroup that are pointlike with respect to $\bHbar$ . Our characterization is effective whenever $\bH$ has a decidable membership problem. In particular, the separation problem for $\bHbar$ -languages is decidable for any decidable variety of finite groups $\bH$ . This generalizes Henckell's theorem on decidability of aperiodic pointlikes. "
1801_01905_draft_v13.tex," The detection of significant \gm-ray emission from radio-loud narrow line Seyfert 1 (NLSy1s) galaxies enables us to study jets in environments different than those in blazars. However, due to the small number of known \gm-ray emitting NLSy1 ( \gm-NLSy1) galaxies, a comprehensive study could not be performed. Here we report the first detection of significant \gm-ray emission from four active galactic nuclei (AGN), recently classified as NLSy1 from their Sloan Digital Sky Survey (SDSS) optical spectrum. Three flat spectrum radio quasars (FSRQs) present in the third Large Area Telescope AGN catalog (3LAC) are also found as \gm-NLSy1 galaxies. Comparing the \gm-ray properties of these objects with 3LAC blazars reveals their spectral shapes to be similar to FSRQs, however, with low 46-47$  \beta$ emission line parameters, we find that on average \gm-NLSy1 have smaller black hole masses than FSRQs at similar redshifts. In the low-resolution SDSS image of one of the \gm-NLSy1 source, we find the evidence of an extended structure. We conclude by noting that overall many observational properties of \gm-NLSy1 sources are similar to FSRQs and therefore, these objects could be their low black hole mass counterparts, as predicted in the literature. "
1801_10274_6th_draft.tex," It was recently found that the Lee-Huang-Yang (LHY) correction to the mean-field Hamiltonian suppresses the collapse and creates stable localized modes (two-component ``quantum droplets"", QDs) in two and three dimensions. We construct two-dimensional \ self-trapped modes in the form of QDs with vorticity $S$ embedded into each component. The QDs feature a flat-top shape, which expands with the increase of $S$ and norm $N$ . An essential finding, produced by a systematic numerical analysis and analytical estimates, is that the vortical QDs are stable (which is a critical issue for vortex solitons in nonlinear models) up to $S=5$ , for $N$ exceeding a certain threshold value. In the condensate of $^{39}$ K atoms, in which QDs with $S=0$ and a quasi-2D shape were created recently, the vortical droplets may have radial size $\lesssim 30$  $\mu $ m, with the number of atoms in the range of $10^{4}-10^{5}$ . It is worthy to note that hidden-vorticity states in QDs with topological charges $% S_{+}=-S_{-}=1$ in its components, which are prone to strong instability in other settings, have their stability region too, although it may be located beyond applicability limits of the underlying model. Dynamics of elliptically deformed QDs, which form rotating elongated patterns or ones with strong oscillations of the eccentricity, as well as collisions of QDs, are also addressed. "
1801_03686_MVerma_2017.tex, % % context heading (optional)
1801_07116_v5.tex," Laying a basis for molecularly specific theory for the mobilities of ions in solutions of practical interest, we report a broad survey of velocity autocorrelation functions (VACFs) of Li $^+$ and PF $_6{}^-$ ions in water, ethylene carbonate, propylene carbonate, and acetonitrile solutions. We extract the memory function, $\gamma(t)$ , which characterizes the random forces governing the mobilities of ions. We provide comparisons, controlling for electrolyte concentration and ion-pairing, for van~der~Waals attractive interactions and solvent molecular characteristics. For the heavier ion (PF $_6{}^-$ ), velocity relaxations are all similar: negative tail relaxations for the VACF and a clear second relaxation for $\gamma\left(t\right)$ , observed previously also for other molecular ions and with n -pentanol as solvent. For the light Li $^+$ ion, short time-scale oscillatory behavior masks simple, longer time-scale relaxation of $\gamma\left(t\right)$ . But the corresponding analysis of the solventberg  Li $^+H_2O\right)_4$ does conform to the standard picture set by all the PF $_6{}^-$ results.  "
1801_02937_IncrementalValidityIndex.tex," Cluster analysis is used to explore structure in unlabeled data sets in a wide range of applications. An important part of cluster analysis is validating the quality of computationally obtained clusters. A large number of different internal indices have been developed for validation in the offline setting. However, this concept has not been extended to the online setting. A key challenge is to find an efficient incremental formulation of an index that can capture both cohesion and separation of the clusters over potentially infinite data streams. In this paper, we develop two online versions (with and without forgetting factors) of the Xie-Beni and Davies-Bouldin internal validity indices, and analyze their characteristics, using two streaming clustering algorithms (sk-means and online ellipsoidal clustering), and illustrate their use in monitoring evolving clusters in streaming data. We also show that incremental cluster validity indices are capable of sending a distress signal to online monitors when evolving clusters go awry. Our numerical examples indicate that the incremental Xie-Beni index with forgetting factor is superior to the other three indices tested. "
1801_02588_FRAG_GUAL.tex," The last decade has seen the detection of fast moving stars in the Galactic halo, the so-called hypervelocity stars (HVSs). While the bulk of this population is likely the result of a close encounter between a stellar binary and the supermassive black hole (MBH) in the Galactic Centre (GC), other mechanims may contribute fast stars to the sample. Few observed HVSs show apparent ages which are shorter than the flight time from the GC, thereby making the binary disruption scenario unlikely. These stars may be the result of the breakup of a stellar triple in the GC which led to the ejection of a hypervelocity binary (HVB). If such binary evolves into a blue straggler star due to internal processes after ejection, a rejuvenation is possible that make the star appear younger once detected in the halo. A triple disruption may also be responsible for the presence of HVBs, of which one candidate has now been observed. We present a numerical study of triple disruptions by the MBH in the GC and find that the most likely outcomes are the production of single HVSs and single/binary stars bound to the MBH, while the production of HVBs has a probability $\lesssim 1\%$ regardless of the initial parameters. Assuming a triple fraction of $\approx 10\%$ results in an ejection rate of $-1$ , insufficient to explain the sample of HVSs with lifetimes shorter than their flight time. We conclude that alternative mechanisms are responsible for the origin of such objects and HVBs in general. "
1801_07808_AspHurKen180118.tex," Pebbling on graphs is a two-player game which involves repeatedly moving a pebble from one vertex to another by removing another pebble from the first vertex. The pebbling number $\pi(G)$ is the least number of pebbles required so that, regardless of the initial configuration of pebbles, a pebble can reach any vertex. Graham conjectured that the pebbling number for the cartesian product, $G \Osq H$ , is bounded above by $\pi(G) \pi(H)$ . We show that $\pi(G \Osq H) \le 2\pi(G) \pi(H)$ and, more sharply, that $\pi(G \Osq H) \le (\pi(G)+|G|) \pi(H)$ . Furthermore, we provide similar results for other graph products and graph operations. "
1801_09240_abstract.tex," The growing popularity of dynamic applications such as social networks provides a promising way to detect valuable information in real time. Efficient analysis over high-speed data from dynamic applications is of great significance. Data from these dynamic applications can be easily modeled as streaming graph. In this paper, we study the subgraph (isomorphism) search over streaming graph data that obeys timing order constraints over the occurrence of edges in the stream. We propose a data structure and algorithm to efficiently answer subgraph search and introduce optimizations to greatly reduce the space cost, and propose concurrency management to improve system throughput. Extensive experiments on real network traffic data and synthetic social streaming data confirms the efficiency and effectiveness of our solution.  The growing popularity of social media provides a promising way to detect realtime events. In this paper, we adopt a graph stream model for event detection over social media. Different from existing work, we propose a LIS (longest increasing subsequence)-based edge weight to evaluate the importance of a keyword co-occurrence with regard to an event. LIS-based measure conquers the limitations of existing metrics, such as ignoring the inherent correlation and sensitive to noises. More importantly, we propose a linear time and space stream algorithm to detect event subgraphs from social media. The elegant theoretical result indicates the high scalability of our graph stream solution in Web-scale social media data. Extensive experiments on real Twitter data confirms the efficiency and effectiveness of our solution. "
1801_03486_manuscript.tex," The evolution of photospheric flow and magnetic fields before and after flares can provide important information regarding the flare triggering and back reaction processes. However, such studies on the flow field are rare due to the paucity of high-resolution observations covering the entire flaring period. Here we study the structural evolution of penumbra and shear flows associated with the 2015 June 22 M6.5 flare in NOAA AR 12371, using high-resolution imaging observation in the TiO band taken by the 1.6~m Goode Solar Telescope at Big Bear Solar Observatory, with the aid of the differential affine velocity estimator method for flow tracking. The accompanied photospheric vector magnetic field changes are also analyzed using data from the Helioseismic and Magnetic Imager. As a result, we found, for a penumbral segment in the negative field adjacent to the magnetic polarity inversion line (PIL), an enhancement of penumbral flows (up to an unusually high value of \sm2~ \kms) and extension of penumbral fibrils after the first peak of the flare hard X-ray (HXR) emission. We also found an area at the PIL, which is co-spatial with a precursor brightening kernel, exhibits a gradual increase of shear flow velocity (up to \sm0.9~ \kms) after the flare. The enhancing penumbral and shear flow regions are also accompanied by an increase of horizontal field and decrease of magnetic inclination angle(measured from the solar surface). These results are discussed in the context of the theory of back reaction of coronal restructuring on the photosphere as a result of flare energy release.  "
1801_05861_GET_Iopt.tex," The generalized linear model plays an important role in statistical analysis and the related design issues are undoubtedly challenging. The state-of-the-art works mostly apply to design criteria on the estimates of regression coefficients. It is of importance to study optimal designs for generalized linear models, especially on the prediction aspects. In this work, we propose a prediction-oriented design criterion, I-optimality, and develop an efficient sequential algorithm of constructing I-optimal designs for generalized linear models. Through establishing the General Equivalence Theorem of the I-optimality for generalized linear models, we obtain an insightful understanding for the proposed algorithm on how to sequentially choose the support points and update the weights of support points of the design. The proposed algorithm is computationally efficient with guaranteed convergence property. Numerical examples are conducted to evaluate the feasibility and computational efficiency of the proposed algorithm. "
1801_09312_article.tex," Quantum thermodynamics is emerging, both as a topic of fundamental research, but also as means to understand and potentially improve the performance of quantum devices~ vinjanampathy_quantum_2016,martinezheat,goold_role_2016,pekola2015,jezouin,schwab,banerjee,sivre,cottet . Superconducting circuit QED (Quantum Electro-Dynamics)~ wallraff presents a prominent platform for the necessary manipulation of quantum states. Thermalization of a quantum system, a subject of intense current interest~ neill_ergodic_2016,srednicki_chaos_1994,kaufman,reimann_eigenstate_2015 , can be achieved by interfacing the circuit QED subsystem with a thermal reservoir of appropriate Hilbert dimensionality. In this context, we consider an assembly consisting of a superconducting qubit~ koch_charge-insensitive_2007 capacitively coupled between two nominally identical coplanar waveguide (CPW) resonators, each terminated by a normal-metal mesoscopic resistor. We report observation of tunable photonic heat transport through the resonator-qubit-resonator assembly. With the aid of a theoretical model presented here, we are able to reproduce experimental data. Importantly, the reservoir-to-reservoir heat flux depends on the interplay between the qubit-resonator and the resonator-reservoir couplings, yielding qualitatively dissimilar results in different coupling regimes. Our Quantum Heat Valve (QHV) is a technological prerequisite for the realisation of quantum heat engines~ rossnagel_single_2016 and refrigerators, that can be obtained, \eg, by exploiting the time-domain dynamics and coherence of driven superconducting qubits~ kosloff,karimi_otto_2016 . This effort would ultimately bridge the gap between the fields of quantum information and thermodynamics of mesoscopic systems. "
1801_04801_IKPFINAL.tex," We consider the 0--1 Incremental Knapsack Problem (IKP) where the capacity grows over time periods and if an item is placed in the knapsack in a certain period, it cannot be removed afterwards. The contribution of a packed item in each time period depends on its profit as well as on a time factor which reflects the importance of the period in the objective function. The problem calls for maximizing the weighted sum of the profits over the whole time horizon. In this work, we provide approximation results for IKP and its restricted variants. In some results, we rely on Linear Programming (LP) to derive approximation bounds and show how the proposed LP--based analysis can be seen as a valid alternative to more formal proof systems. We first manage to prove the tightness of some approximation ratios of a general purpose algorithm currently available in the literature and originally applied to a time-invariant version of the problem. We also devise a Polynomial Time Approximation Scheme (PTAS) when the input value indicating the number of periods is considered as a constant. Then, we add the mild and natural assumption that each item can be packed in the first time period. For this variant, we discuss different approximation algorithms suited for any number of time periods and for the special case with two periods. "
